{
 "scenario_id": "scn_z2_s1v_lato_opposto",
 "version": 1,
 "baseline_id": "bas_z2_20261001",
 "title": "S1v variante sensibilità: lato opposto su R01: regola dichiarata: tratto di 60 m di R01 (da 236 a 296 m dall'origine) con massima frazione media al sole, 15 settembre 12:30-13:30 (a parità: media 8-18, poi la prima lungo il percorso), caso edifici documentati, asse della rete; 7 alberi, interasse 8 m, a 3 m dall'asse; lato opposto a quello del sole alle 13:00 (ipotesi, il lato del marciapiede non è noto)",
 "author": "agente T10 (scenario dimostrativo)",
 "created_at": "2026-10-01T20:00:00Z",
 "operations": [
  {
   "op_id": "op_albero_01",
   "op": "add",
   "target_type": "tree",
   "geometry": {
    "type": "Point",
    "coordinates": [
     612693.84,
     4840513.92
    ]
   },
   "dimensions": {
    "height_m": {
     "value": 11.0,
     "unit": "m",
     "classification": "scenario",
     "dimension_source": "classe scenario 'medio', valore tipico di geometry/parametri_chiome.json (stima di classe, non misura né progetto)"
    },
    "crown_diameter_m": {
     "value": 6.0,
     "unit": "m",
     "classification": "scenario",
     "dimension_source": "classe scenario 'medio', valore tipico di geometry/parametri_chiome.json (stima di classe, non misura né progetto)"
    },
    "crown_base_m": {
     "value": 2.5,
     "unit": "m",
     "classification": "scenario",
     "dimension_source": "classe scenario 'medio', valore tipico di geometry/parametri_chiome.json (stima di classe, non misura né progetto)"
    }
   },
   "hypothesis_status": "feasibility_unknown",
   "note": "Fattibilità ignota: sottoservizi, spazio radicale, proprietà del suolo e specie non verificati."
  },
  {
   "op_id": "op_albero_02",
   "op": "add",
   "target_type": "tree",
   "geometry": {
    "type": "Point",
    "coordinates": [
     612698.84,
     4840510.12
    ]
   },
   "dimensions": {
    "height_m": {
     "value": 11.0,
     "unit": "m",
     "classification": "scenario",
     "dimension_source": "classe scenario 'medio', valore tipico di geometry/parametri_chiome.json (stima di classe, non misura né progetto)"
    },
    "crown_diameter_m": {
     "value": 6.0,
     "unit": "m",
     "classification": "scenario",
     "dimension_source": "classe scenario 'medio', valore tipico di geometry/parametri_chiome.json (stima di classe, non misura né progetto)"
    },
    "crown_base_m": {
     "value": 2.5,
     "unit": "m",
     "classification": "scenario",
     "dimension_source": "classe scenario 'medio', valore tipico di geometry/parametri_chiome.json (stima di classe, non misura né progetto)"
    }
   },
   "hypothesis_status": "feasibility_unknown",
   "note": "Fattibilità ignota: sottoservizi, spazio radicale, proprietà del suolo e specie non verificati."
  },
  {
   "op_id": "op_albero_03",
   "op": "add",
   "target_type": "tree",
   "geometry": {
    "type": "Point",
    "coordinates": [
     612706.03,
     4840506.71
    ]
   },
   "dimensions": {
    "height_m": {
     "value": 11.0,
     "unit": "m",
     "classification": "scenario",
     "dimension_source": "classe scenario 'medio', valore tipico di geometry/parametri_chiome.json (stima di classe, non misura né progetto)"
    },
    "crown_diameter_m": {
     "value": 6.0,
     "unit": "m",
     "classification": "scenario",
     "dimension_source": "classe scenario 'medio', valore tipico di geometry/parametri_chiome.json (stima di classe, non misura né progetto)"
    },
    "crown_base_m": {
     "value": 2.5,
     "unit": "m",
     "classification": "scenario",
     "dimension_source": "classe scenario 'medio', valore tipico di geometry/parametri_chiome.json (stima di classe, non misura né progetto)"
    }
   },
   "hypothesis_status": "feasibility_unknown",
   "note": "Fattibilità ignota: sottoservizi, spazio radicale, proprietà del suolo e specie non verificati."
  },
  {
   "op_id": "op_albero_04",
   "op": "add",
   "target_type": "tree",
   "geometry": {
    "type": "Point",
    "coordinates": [
     612713.3,
     4840503.35
    ]
   },
   "dimensions": {
    "height_m": {
     "value": 11.0,
     "unit": "m",
     "classification": "scenario",
     "dimension_source": "classe scenario 'medio', valore tipico di geometry/parametri_chiome.json (stima di classe, non misura né progetto)"
    },
    "crown_diameter_m": {
     "value": 6.0,
     "unit": "m",
     "classification": "scenario",
     "dimension_source": "classe scenario 'medio', valore tipico di geometry/parametri_chiome.json (stima di classe, non misura né progetto)"
    },
    "crown_base_m": {
     "value": 2.5,
     "unit": "m",
     "classification": "scenario",
     "dimension_source": "classe scenario 'medio', valore tipico di geometry/parametri_chiome.json (stima di classe, non misura né progetto)"
    }
   },
   "hypothesis_status": "feasibility_unknown",
   "note": "Fattibilità ignota: sottoservizi, spazio radicale, proprietà del suolo e specie non verificati."
  },
  {
   "op_id": "op_albero_05",
   "op": "add",
   "target_type": "tree",
   "geometry": {
    "type": "Point",
    "coordinates": [
     612720.55,
     4840500.08
    ]
   },
   "dimensions": {
    "height_m": {
     "value": 11.0,
     "unit": "m",
     "classification": "scenario",
     "dimension_source": "classe scenario 'medio', valore tipico di geometry/parametri_chiome.json (stima di classe, non misura né progetto)"
    },
    "crown_diameter_m": {
     "value": 6.0,
     "unit": "m",
     "classification": "scenario",
     "dimension_source": "classe scenario 'medio', valore tipico di geometry/parametri_chiome.json (stima di classe, non misura né progetto)"
    },
    "crown_base_m": {
     "value": 2.5,
     "unit": "m",
     "classification": "scenario",
     "dimension_source": "classe scenario 'medio', valore tipico di geometry/parametri_chiome.json (stima di classe, non misura né progetto)"
    }
   },
   "hypothesis_status": "feasibility_unknown",
   "note": "Fattibilità ignota: sottoservizi, spazio radicale, proprietà del suolo e specie non verificati."
  },
  {
   "op_id": "op_albero_06",
   "op": "add",
   "target_type": "tree",
   "geometry": {
    "type": "Point",
    "coordinates": [
     612727.84,
     4840496.78
    ]
   },
   "dimensions": {
    "height_m": {
     "value": 11.0,
     "unit": "m",
     "classification": "scenario",
     "dimension_source": "classe scenario 'medio', valore tipico di geometry/parametri_chiome.json (stima di classe, non misura né progetto)"
    },
    "crown_diameter_m": {
     "value": 6.0,
     "unit": "m",
     "classification": "scenario",
     "dimension_source": "classe scenario 'medio', valore tipico di geometry/parametri_chiome.json (stima di classe, non misura né progetto)"
    },
    "crown_base_m": {
     "value": 2.5,
     "unit": "m",
     "classification": "scenario",
     "dimension_source": "classe scenario 'medio', valore tipico di geometry/parametri_chiome.json (stima di classe, non misura né progetto)"
    }
   },
   "hypothesis_status": "feasibility_unknown",
   "note": "Fattibilità ignota: sottoservizi, spazio radicale, proprietà del suolo e specie non verificati."
  },
  {
   "op_id": "op_albero_07",
   "op": "add",
   "target_type": "tree",
   "geometry": {
    "type": "Point",
    "coordinates": [
     612735.13,
     4840493.48
    ]
   },
   "dimensions": {
    "height_m": {
     "value": 11.0,
     "unit": "m",
     "classification": "scenario",
     "dimension_source": "classe scenario 'medio', valore tipico di geometry/parametri_chiome.json (stima di classe, non misura né progetto)"
    },
    "crown_diameter_m": {
     "value": 6.0,
     "unit": "m",
     "classification": "scenario",
     "dimension_source": "classe scenario 'medio', valore tipico di geometry/parametri_chiome.json (stima di classe, non misura né progetto)"
    },
    "crown_base_m": {
     "value": 2.5,
     "unit": "m",
     "classification": "scenario",
     "dimension_source": "classe scenario 'medio', valore tipico di geometry/parametri_chiome.json (stima di classe, non misura né progetto)"
    }
   },
   "hypothesis_status": "feasibility_unknown",
   "note": "Fattibilità ignota: sottoservizi, spazio radicale, proprietà del suolo e specie non verificati."
  }
 ]
}