{
 "scenario_id": "scn_z2_s2_pensilina_pellico",
 "version": 1,
 "baseline_id": "bas_z2_20261001",
 "title": "S2 pensilina alla fermata Pellico (dimensione dichiarata)",
 "author": "agente T10 (scenario dimostrativo)",
 "created_at": "2026-10-01T20:00:00Z",
 "operations": [
  {
   "op_id": "op_pensilina_01",
   "op": "add",
   "target_type": "shelter",
   "geometry": {
    "type": "Polygon",
    "coordinates": [
     [
      [
       612593.39,
       4840666.92
      ],
      [
       612592.94,
       4840660.93
      ],
      [
       612590.95,
       4840661.08
      ],
      [
       612591.4,
       4840667.07
      ],
      [
       612593.39,
       4840666.92
      ]
     ]
    ]
   },
   "dimensions": {
    "roof_height_m": {
     "value": 3.0,
     "unit": "m",
     "classification": "scenario",
     "dimension_source": "ipotesi di dimensione tipica di una pensilina da fermata (6 m x 2 m, intradosso 2,5 m, tetto 3,0 m): non da progetto"
    },
    "canopy_base_m": {
     "value": 2.5,
     "unit": "m",
     "classification": "scenario",
     "dimension_source": "ipotesi di dimensione tipica di una pensilina da fermata (6 m x 2 m, intradosso 2,5 m, tetto 3,0 m): non da progetto"
    },
    "length_m": {
     "value": 6.0,
     "unit": "m",
     "classification": "scenario",
     "dimension_source": "ipotesi di dimensione tipica di una pensilina da fermata (6 m x 2 m, intradosso 2,5 m, tetto 3,0 m): non da progetto"
    },
    "depth_m": {
     "value": 2.0,
     "unit": "m",
     "classification": "scenario",
     "dimension_source": "ipotesi di dimensione tipica di una pensilina da fermata (6 m x 2 m, intradosso 2,5 m, tetto 3,0 m): non da progetto"
    }
   },
   "hypothesis_status": "feasibility_unknown",
   "note": "Alla fermata Pellico PI4390, centrata sulla piattaforma OSM, lato lungo parallelo al marciapiede. Fattibilità ignota: sottoservizi, proprietà del suolo, larghezza libera del marciapiede."
  }
 ]
}